{
  "calculations": [
    {
      "code_ref": "scripts/build_migration_story_ir.py",
      "id": "calc-top30-sum-1990",
      "input_fact_ids": [
        "q-1990-01",
        "q-1990-02",
        "q-1990-03",
        "q-1990-04",
        "q-1990-05",
        "q-1990-06",
        "q-1990-07",
        "q-1990-08",
        "q-1990-09",
        "q-1990-10",
        "q-1990-11",
        "q-1990-12",
        "q-1990-13",
        "q-1990-14",
        "q-1990-15",
        "q-1990-16",
        "q-1990-17",
        "q-1990-18",
        "q-1990-19",
        "q-1990-20",
        "q-1990-21",
        "q-1990-22",
        "q-1990-23",
        "q-1990-24",
        "q-1990-25",
        "q-1990-26",
        "q-1990-27",
        "q-1990-28",
        "q-1990-29",
        "q-1990-30"
      ],
      "operation": "sum estimated_flow_mean for the ranked top-30 selection in 1990",
      "replay_status": "passed",
      "result_sha256": "c608088f3325f118cbf684ea1365daa0247a5c69bccfe29db8574683dd433559"
    },
    {
      "code_ref": "scripts/build_migration_story_ir.py",
      "id": "calc-top30-sum-2000",
      "input_fact_ids": [
        "q-2000-01",
        "q-2000-02",
        "q-2000-03",
        "q-2000-04",
        "q-2000-05",
        "q-2000-06",
        "q-2000-07",
        "q-2000-08",
        "q-2000-09",
        "q-2000-10",
        "q-2000-11",
        "q-2000-12",
        "q-2000-13",
        "q-2000-14",
        "q-2000-15",
        "q-2000-16",
        "q-2000-17",
        "q-2000-18",
        "q-2000-19",
        "q-2000-20",
        "q-2000-21",
        "q-2000-22",
        "q-2000-23",
        "q-2000-24",
        "q-2000-25",
        "q-2000-26",
        "q-2000-27",
        "q-2000-28",
        "q-2000-29",
        "q-2000-30"
      ],
      "operation": "sum estimated_flow_mean for the ranked top-30 selection in 2000",
      "replay_status": "passed",
      "result_sha256": "c608088f3325f118cbf684ea1365daa0247a5c69bccfe29db8574683dd433559"
    },
    {
      "code_ref": "scripts/build_migration_story_ir.py",
      "id": "calc-top30-sum-2010",
      "input_fact_ids": [
        "q-2010-01",
        "q-2010-02",
        "q-2010-03",
        "q-2010-04",
        "q-2010-05",
        "q-2010-06",
        "q-2010-07",
        "q-2010-08",
        "q-2010-09",
        "q-2010-10",
        "q-2010-11",
        "q-2010-12",
        "q-2010-13",
        "q-2010-14",
        "q-2010-15",
        "q-2010-16",
        "q-2010-17",
        "q-2010-18",
        "q-2010-19",
        "q-2010-20",
        "q-2010-21",
        "q-2010-22",
        "q-2010-23",
        "q-2010-24",
        "q-2010-25",
        "q-2010-26",
        "q-2010-27",
        "q-2010-28",
        "q-2010-29",
        "q-2010-30"
      ],
      "operation": "sum estimated_flow_mean for the ranked top-30 selection in 2010",
      "replay_status": "passed",
      "result_sha256": "c608088f3325f118cbf684ea1365daa0247a5c69bccfe29db8574683dd433559"
    },
    {
      "code_ref": "scripts/build_migration_story_ir.py",
      "id": "calc-top30-sum-2020",
      "input_fact_ids": [
        "q-2020-01",
        "q-2020-02",
        "q-2020-03",
        "q-2020-04",
        "q-2020-05",
        "q-2020-06",
        "q-2020-07",
        "q-2020-08",
        "q-2020-09",
        "q-2020-10",
        "q-2020-11",
        "q-2020-12",
        "q-2020-13",
        "q-2020-14",
        "q-2020-15",
        "q-2020-16",
        "q-2020-17",
        "q-2020-18",
        "q-2020-19",
        "q-2020-20",
        "q-2020-21",
        "q-2020-22",
        "q-2020-23",
        "q-2020-24",
        "q-2020-25",
        "q-2020-26",
        "q-2020-27",
        "q-2020-28",
        "q-2020-29",
        "q-2020-30"
      ],
      "operation": "sum estimated_flow_mean for the ranked top-30 selection in 2020",
      "replay_status": "passed",
      "result_sha256": "c608088f3325f118cbf684ea1365daa0247a5c69bccfe29db8574683dd433559"
    },
    {
      "code_ref": "scripts/build_migration_story_ir.py",
      "id": "calc-top30-sum-2023",
      "input_fact_ids": [
        "q-2023-01",
        "q-2023-02",
        "q-2023-03",
        "q-2023-04",
        "q-2023-05",
        "q-2023-06",
        "q-2023-07",
        "q-2023-08",
        "q-2023-09",
        "q-2023-10",
        "q-2023-11",
        "q-2023-12",
        "q-2023-13",
        "q-2023-14",
        "q-2023-15",
        "q-2023-16",
        "q-2023-17",
        "q-2023-18",
        "q-2023-19",
        "q-2023-20",
        "q-2023-21",
        "q-2023-22",
        "q-2023-23",
        "q-2023-24",
        "q-2023-25",
        "q-2023-26",
        "q-2023-27",
        "q-2023-28",
        "q-2023-29",
        "q-2023-30"
      ],
      "operation": "sum estimated_flow_mean for the ranked top-30 selection in 2023",
      "replay_status": "passed",
      "result_sha256": "c608088f3325f118cbf684ea1365daa0247a5c69bccfe29db8574683dd433559"
    }
  ],
  "entities": [
    {
      "evidence_ids": [
        "ev-migration",
        "ev-geography"
      ],
      "id": "country:AFG",
      "kind": "country",
      "label": "Afghanistan"
    },
    {
      "evidence_ids": [
        "ev-migration",
        "ev-geography"
      ],
      "id": "country:ARE",
      "kind": "country",
      "label": "United Arab Emirates"
    },
    {
      "evidence_ids": [
        "ev-migration",
        "ev-geography"
      ],
      "id": "country:AZE",
      "kind": "country",
      "label": "Azerbaijan"
    },
    {
      "evidence_ids": [
        "ev-migration",
        "ev-geography"
      ],
      "id": "country:BFA",
      "kind": "country",
      "label": "Burkina Faso"
    },
    {
      "evidence_ids": [
        "ev-migration",
        "ev-geography"
      ],
      "id": "country:BGD",
      "kind": "country",
      "label": "Bangladesh"
    },
    {
      "evidence_ids": [
        "ev-migration",
        "ev-geography"
      ],
      "id": "country:BIH",
      "kind": "country",
      "label": "Bosnia and Herzegovina"
    },
    {
      "evidence_ids": [
        "ev-migration",
        "ev-geography"
      ],
      "id": "country:CAN",
      "kind": "country",
      "label": "Canada"
    },
    {
      "evidence_ids": [
        "ev-migration",
        "ev-geography"
      ],
      "id": "country:CHN",
      "kind": "country",
      "label": "China"
    },
    {
      "evidence_ids": [
        "ev-migration",
        "ev-geography"
      ],
      "id": "country:CIV",
      "kind": "country",
      "label": "Ivory Coast"
    },
    {
      "evidence_ids": [
        "ev-migration",
        "ev-geography"
      ],
      "id": "country:COL",
      "kind": "country",
      "label": "Colombia"
    },
    {
      "evidence_ids": [
        "ev-migration",
        "ev-geography"
      ],
      "id": "country:DEU",
      "kind": "country",
      "label": "Germany"
    },
    {
      "evidence_ids": [
        "ev-migration",
        "ev-geography"
      ],
      "id": "country:EGY",
      "kind": "country",
      "label": "Egypt"
    },
    {
      "evidence_ids": [
        "ev-migration",
        "ev-geography"
      ],
      "id": "country:ERI",
      "kind": "country",
      "label": "Eritrea"
    },
    {
      "evidence_ids": [
        "ev-migration",
        "ev-geography"
      ],
      "id": "country:ETH",
      "kind": "country",
      "label": "Ethiopia"
    },
    {
      "evidence_ids": [
        "ev-migration",
        "ev-geography"
      ],
      "id": "country:GBR",
      "kind": "country",
      "label": "United Kingdom"
    },
    {
      "evidence_ids": [
        "ev-migration",
        "ev-geography"
      ],
      "id": "country:GTM",
      "kind": "country",
      "label": "Guatemala"
    },
    {
      "evidence_ids": [
        "ev-migration",
        "ev-geography"
      ],
      "id": "country:HKG",
      "kind": "country",
      "label": "Hong Kong S.A.R."
    },
    {
      "evidence_ids": [
        "ev-migration",
        "ev-geography"
      ],
      "id": "country:HRV",
      "kind": "country",
      "label": "Croatia"
    },
    {
      "evidence_ids": [
        "ev-migration",
        "ev-geography"
      ],
      "id": "country:IDN",
      "kind": "country",
      "label": "Indonesia"
    },
    {
      "evidence_ids": [
        "ev-migration",
        "ev-geography"
      ],
      "id": "country:IND",
      "kind": "country",
      "label": "India"
    },
    {
      "evidence_ids": [
        "ev-migration",
        "ev-geography"
      ],
      "id": "country:IRN",
      "kind": "country",
      "label": "Iran"
    },
    {
      "evidence_ids": [
        "ev-migration",
        "ev-geography"
      ],
      "id": "country:IRQ",
      "kind": "country",
      "label": "Iraq"
    },
    {
      "evidence_ids": [
        "ev-migration",
        "ev-geography"
      ],
      "id": "country:ITA",
      "kind": "country",
      "label": "Italy"
    },
    {
      "evidence_ids": [
        "ev-migration",
        "ev-geography"
      ],
      "id": "country:JOR",
      "kind": "country",
      "label": "Jordan"
    },
    {
      "evidence_ids": [
        "ev-migration",
        "ev-geography"
      ],
      "id": "country:JPN",
      "kind": "country",
      "label": "Japan"
    },
    {
      "evidence_ids": [
        "ev-migration",
        "ev-geography"
      ],
      "id": "country:KAZ",
      "kind": "country",
      "label": "Kazakhstan"
    },
    {
      "evidence_ids": [
        "ev-migration",
        "ev-geography"
      ],
      "id": "country:KOR",
      "kind": "country",
      "label": "South Korea"
    },
    {
      "evidence_ids": [
        "ev-migration",
        "ev-geography"
      ],
      "id": "country:KWT",
      "kind": "country",
      "label": "Kuwait"
    },
    {
      "evidence_ids": [
        "ev-migration",
        "ev-geography"
      ],
      "id": "country:LAO",
      "kind": "country",
      "label": "Laos"
    },
    {
      "evidence_ids": [
        "ev-migration",
        "ev-geography"